{
  "artifact_type":"checkpoint_index",
  "schema_version":"1.0.0",
  "project_id":"hive-plan",
  "repository":"KayzenRoot/hive-plan",
  "active_workstream_id":"implementation/hp-wo-0001",
  "workstreams":[
    {
      "workstream_id":"planning/hp-plan-010",
      "kind":"PLANNING",
      "issue_id":23,
      "work_order_id":null,
      "branch":"docs/hp-plan-010-engineering-chat-project-brain",
      "latest_checkpoint_id":"HP-CP-0022",
      "latest_checkpoint_digest":"sha256:69b277b897d8ee3b06c8d3f0ba89ef234cfe3d43c75bab4ca85b433efe649d74",
      "latest_checkpoint_path":"checkpoints/history/HP-CP-0022.json",
      "status":"COMPLETED",
      "priority":90,
      "updated_at":"2026-09-11T19:16:00Z"
    },
    {
      "workstream_id":"implementation/hp-wo-0001",
      "kind":"IMPLEMENTATION",
      "issue_id":21,
      "work_order_id":"HP-WO-0001",
      "branch":"feat/hp-wo-0001-cockpit-foundation",
      "latest_checkpoint_id":"HP-CP-WO-0001-OBS-001",
      "latest_checkpoint_digest":"sha256:039ed91dac2288d9548bce9e2087804d8c961202c176a37e1c6bec7cc0649ce0",
      "latest_checkpoint_path":"checkpoints/history/HP-CP-WO-0001-OBS-001.json",
      "status":"ACTIVE",
      "priority":100,
      "updated_at":"2026-09-11T19:16:00Z"
    }
  ],
  "updated_at":"2026-09-11T19:16:00Z"
}